<?xml version="1.0" encoding="UTF-8"?>
<!DOCTYPE SHOW_PRICELIST_002 SYSTEM 'colinx_show_pricelist_002.dtd'><SHOW_PRICELIST_002>
    <CNTROLAREA>
        <BSR>
            <VERB>SHOW</VERB>
            <NOUN>PRICELIST</NOUN>
            <REVISION>002</REVISION>
        </BSR>
        <SENDER>
            <LOGICALID>SKFSKF</LOGICALID>
            <COMPONENT>PTPLACE</COMPONENT>
            <TASK>SHOW</TASK>
            <REFERENCEID>CLXPTP-SKFSKF-00015887693980054222-0001</REFERENCEID>
            <CONFIRMATION>0</CONFIRMATION>
            <LANGUAGE>ENG</LANGUAGE>
            <CODEPAGE>UTF-8</CODEPAGE>
            <AUTHID>SKFSKF-CLXPTP-00015887693980054222-0002</AUTHID>
        </SENDER>
        <DATETIME qualifier="CREATION">
            <YEAR>2020</YEAR>
            <MONTH>5</MONTH>
            <DAY>6</DAY>
            <HOUR>14</HOUR>
            <MINUTE>49</MINUTE>
            <SECOND>59</SECOND>
            <SUBSECOND>707</SUBSECOND>
            <TIMEZONE>+0100</TIMEZONE>
        </DATETIME>
    </CNTROLAREA>
    <DATAAREA>
        <SHOW_PRICELIST>
            <PRICELIST>
                <PRICELSTID>Customer</PRICELSTID>
                <CURRENCY>USD</CURRENCY>
                <PARTNRID>60599</PARTNRID>
                <PRCLSTLINE>
                    <OPERAMT qualifier="UNIT" type="T">
                        <VALUE>537</VALUE>
                        <NUMOFDEC>2</NUMOFDEC>
                        <SIGN>+</SIGN>
                        <CURRENCY>USD</CURRENCY>
                        <UOMVALUE>10000</UOMVALUE>
                        <UOMNUMDEC>4</UOMNUMDEC>
                        <UOM>EA</UOM>
                    </OPERAMT>
                    <LINENUM>1</LINENUM>
                    <PARTREF>
                        <PARTTYPE>Manufacturer</PARTTYPE>
                        <PARTNO>6203</PARTNO>
                        <PARTKEY>0000427</PARTKEY>
                        <PARTQUAL>Manufacturer</PARTQUAL>
                    </PARTREF>
                    <PRCLSTLINE_USERAREA>
                        <COLINX_INSTOCK>INSTOCK</COLINX_INSTOCK>
                        <DATETIME qualifier="REQUIRED">
                            <YEAR>2020</YEAR>
                            <MONTH>05</MONTH>
                            <DAY>06</DAY>
                            <HOUR>00</HOUR>
                            <MINUTE>00</MINUTE>
                            <SECOND>00</SECOND>
                            <SUBSECOND>0000</SUBSECOND>
                            <TIMEZONE>-0500</TIMEZONE>
                        </DATETIME>
                        <QUANTITY qualifier="ORDERED">
                            <VALUE>1</VALUE>
                            <NUMOFDEC>0</NUMOFDEC>
                            <SIGN>+</SIGN>
                            <UOM>EA</UOM>
                        </QUANTITY>
                        <COLINX_STATUS>
                            <REASONCODE>0000</REASONCODE>
                        </COLINX_STATUS>
                        <SITELEVEL index="1">MyWrhse</SITELEVEL>
                        <COLINX_PRODAVAIL>
                            <DEFAULTIND>Y</DEFAULTIND>
                            <COLINX_SORTORDER>1</COLINX_SORTORDER>
                            <PACKING>12</PACKING>
                            <QUANTITY qualifier="LOTSIZEMIN">
                                <VALUE>1</VALUE>
                                <NUMOFDEC>0</NUMOFDEC>
                                <SIGN>+</SIGN>
                                <UOM>EA</UOM>
                            </QUANTITY>
                            <QUANTITY qualifier="LOTSIZEMLT">
                                <VALUE>1</VALUE>
                                <NUMOFDEC>0</NUMOFDEC>
                                <SIGN>+</SIGN>
                                <UOM>EA</UOM>
                            </QUANTITY>
                            <WHSEDETAIL>
                                <QUANTITY qualifier="AVAILABLE">
                                    <VALUE>0</VALUE>
                                    <NUMOFDEC>0</NUMOFDEC>
                                    <SIGN>+</SIGN>
                                    <UOM>EA</UOM>
                                </QUANTITY>
                                <COLINX_AVAILDESC>No Stock</COLINX_AVAILDESC>
                                <SITELEVEL index="1">SparksNV</SITELEVEL>
                                <ORDERABLE>Y</ORDERABLE>
                                <PRIORITY>Primary</PRIORITY>
                                <COLINX_SORTORDER>1</COLINX_SORTORDER>
                                <DEFAULTIND>Y</DEFAULTIND>
                            </WHSEDETAIL>
                            <WHSEDETAIL>
                                <QUANTITY qualifier="AVAILABLE">
                                    <VALUE>1084</VALUE>
                                    <NUMOFDEC>0</NUMOFDEC>
                                    <SIGN>+</SIGN>
                                    <UOM>EA</UOM>
                                </QUANTITY>
                                <COLINX_AVAILDESC>Stock</COLINX_AVAILDESC>
                                <SITELEVEL index="1">CvilleTN</SITELEVEL>
                                <ORDERABLE>Y</ORDERABLE>
                                <PRIORITY>Secondary</PRIORITY>
                                <COLINX_SORTORDER>2</COLINX_SORTORDER>
                                <DEFAULTIND>N</DEFAULTIND>
                            </WHSEDETAIL>
                            <WHSEDETAIL>
                                <QUANTITY qualifier="AVAILABLE">
                                    <VALUE>5587</VALUE>
                                    <NUMOFDEC>0</NUMOFDEC>
                                    <SIGN>+</SIGN>
                                    <UOM>EA</UOM>
                                </QUANTITY>
                                <COLINX_AVAILDESC>Next 2 weeks</COLINX_AVAILDESC>
                                <SITELEVEL index="1">CvilleTN</SITELEVEL>
                                <ORDERABLE>Y</ORDERABLE>
                                <PRODORDID>SCHD</PRODORDID>
                                <PRIORITY>Secondary</PRIORITY>
                                <COLINX_SORTORDER>3</COLINX_SORTORDER>
                                <DEFAULTIND>N</DEFAULTIND>
                            </WHSEDETAIL>
                            <WHSEDETAIL>
                                <QUANTITY qualifier="AVAILABLE">
                                    <VALUE>2474</VALUE>
                                    <NUMOFDEC>0</NUMOFDEC>
                                    <SIGN>+</SIGN>
                                    <UOM>EA</UOM>
                                </QUANTITY>
                                <COLINX_AVAILDESC>Beyond 2 weeks</COLINX_AVAILDESC>
                                <SITELEVEL index="1">CvilleTN</SITELEVEL>
                                <ORDERABLE>Y</ORDERABLE>
                                <PRODORDID>SCHD</PRODORDID>
                                <PRIORITY>Secondary</PRIORITY>
                                <COLINX_SORTORDER>4</COLINX_SORTORDER>
                                <DEFAULTIND>N</DEFAULTIND>
                            </WHSEDETAIL>
                        </COLINX_PRODAVAIL>
                        <COLINX_PRODAVAIL>
                            <DEFAULTIND>N</DEFAULTIND>
                            <COLINX_SORTORDER>2</COLINX_SORTORDER>
                            <PACKING>01</PACKING>
                            <QUANTITY qualifier="LOTSIZEMIN">
                                <VALUE>210</VALUE>
                                <NUMOFDEC>0</NUMOFDEC>
                                <SIGN>+</SIGN>
                                <UOM>EA</UOM>
                            </QUANTITY>
                            <QUANTITY qualifier="LOTSIZEMLT">
                                <VALUE>210</VALUE>
                                <NUMOFDEC>0</NUMOFDEC>
                                <SIGN>+</SIGN>
                                <UOM>EA</UOM>
                            </QUANTITY>
                            <WHSEDETAIL>
                                <QUANTITY qualifier="AVAILABLE">
                                    <VALUE>840</VALUE>
                                    <NUMOFDEC>0</NUMOFDEC>
                                    <SIGN>+</SIGN>
                                    <UOM>EA</UOM>
                                </QUANTITY>
                                <COLINX_AVAILDESC>Stock</COLINX_AVAILDESC>
                                <SITELEVEL index="1">CvilleTN</SITELEVEL>
                                <ORDERABLE>Y</ORDERABLE>
                                <PRIORITY>Secondary</PRIORITY>
                                <COLINX_SORTORDER>5</COLINX_SORTORDER>
                                <DEFAULTIND>N</DEFAULTIND>
                            </WHSEDETAIL>
                            <WHSEDETAIL>
                                <QUANTITY qualifier="AVAILABLE">
                                    <VALUE>840</VALUE>
                                    <NUMOFDEC>0</NUMOFDEC>
                                    <SIGN>+</SIGN>
                                    <UOM>EA</UOM>
                                </QUANTITY>
                                <COLINX_AVAILDESC>Next 2 weeks</COLINX_AVAILDESC>
                                <SITELEVEL index="1">CvilleTN</SITELEVEL>
                                <ORDERABLE>Y</ORDERABLE>
                                <PRODORDID>SCHD</PRODORDID>
                                <PRIORITY>Secondary</PRIORITY>
                                <COLINX_SORTORDER>6</COLINX_SORTORDER>
                                <DEFAULTIND>N</DEFAULTIND>
                            </WHSEDETAIL>
                            <WHSEDETAIL>
                                <QUANTITY qualifier="AVAILABLE">
                                    <VALUE>210</VALUE>
                                    <NUMOFDEC>0</NUMOFDEC>